,created_at,id_str,full_text,quote_count,reply_count,retweet_count,favorite_count,lang,user_id_str,conversation_id_str,username,tweet_url,clean_text,label,score,label_bert,score_bert
411,Sat Oct 28 22:20:33 +0000 2023,1718392334277349680,@Wawan_74 @Karsono12732862 @Amran_bin_Ali @AntonKu32183838 @dady_tri @KasmaranWahyu @Kode_Bagus @the3brothers2 @PribadiBales @Irfan_Cowgan @LonenyDragon @RefublikAteis @Ezharhap @Diek_Clev @asasfuro @DiposuroP @Karuhun_69 @JokoPintar2 @hoax_bukan @SobatMIDO @aikel112629 @creampie_99 @roedinapit @tkngsiomay @Yudiantiyaman @ZtrideorDIE @KavezuAzila @ScioCogitoCredo @wrahardian2 @sugi_0706 @PUTRY_NUSANTARA @gus_ur_ @HeryIdris5 @Samsulhuda1988 @puspita3_eka @kupret93840851 @Mayapada0812 @yantireinke @Pahamya_Okesip @AlamTimur3 @NembeNetes @SontoJoko @ZainalAbdi78 @prabowo https://t.co/oYKqqtes2k  berebut diakuin china... https://t.co/ARRYANVFGL,0,0,0,0,in,982439595710152705,1477949011449446400,madularang,https://twitter.com/madularang/status/1718392334277349680,wawan 74 karsono12732862 amran bin ali antonku32183838 dady tri kasmaranwahyu kode bagus the3brothers2 pribadibales irfan cowgan lonenydragon refublikateis ezharhap diek clev asasfuro diposurop karuhun 69 jokopintar2 hoax sobatmido aikel112629 creampie 99 roedinapit tkngsiomay yudiantiyaman ztrideordie kavezuazila sciocogitocredo wrahardian2 sugi 0706 putry nusantara gus ur heryidris5 samsulhuda1988 puspita3 eka kupret93840851 mayapada0812 yantireinke pahamya okesip alamtimur3 nembenetes sontojoko zainalabdi78 prabowo rebut diakuin china,neutral,0.9994009733200073,neutral,0.7867928743362427
412,Sat Oct 28 22:20:20 +0000 2023,1718392280518910115,"@dul_ises @OposisiCerdas Terkait Mr.  prabowo, gak habis pikir yg oleng itu beliau apa pembisik dan  pengawalnya yg tak pas membuat strategi pemenangan. Didambakan didukung dan di elukan ujung beritanya bikin kecewa owe.",0,0,0,0,in,1603672568992784384,1717826034102665677,AmrullahMap,https://twitter.com/AmrullahMap/status/1718392280518910115,dul ises oposisicerdas kait mr prabowo gak habis pikir yg oleng beliau bisik yg pas strategi menang damba dukung elu ujung berita bikin kecewa owe,negative,0.9997915625572205,negative,0.9956881403923035
413,Sat Oct 28 22:20:04 +0000 2023,1718392214697676884,"@TajukPolitik coba lihat trennya, Ganjar yg biasane diatas 35% turun jadi 30%, Prabowo jg turun jadi 37%, semakin banyak swing voters, kemanakah swing voters ini berlabuh",0,0,0,2,in,473417028,1718241446875344925,muhammadsyakur2,https://twitter.com/muhammadsyakur2/status/1718392214697676884,tajukpolitik coba lihat tren ganjar yg biasane 35 turun 30 prabowo jg turun 37 swing voters swing voters labuh,neutral,0.9996540546417236,neutral,0.9859763383865356
414,Sat Oct 28 22:19:48 +0000 2023,1718392147366609191,@masisbisnis @Leonita_Lestari Aq bukan pendukung Prabowo Gibran tapi aq dukung anak pak Jokowi...sami mawon kocak lo,0,0,0,1,in,1376558427342704641,1718217674008957134,Gembel83522575,https://twitter.com/Gembel83522575/status/1718392147366609191,masisbisnis leonita lestari aq dukung prabowo gibran aq dukung anak jokowi sami mawon kocak lo,negative,0.998407781124115,positive,0.94496750831604
415,Sat Oct 28 22:19:29 +0000 2023,1718392067582574921,"@Brosist2045 @temanduit @kya40697200 @yunartowijaya Sudah direncanakan sejak awal pastinya, si botak ditugaskan oleh si penculik @prabowo utk menjebak @ganjarpranowo, jangan2 gabungnya si penculik ke pemerintahan @jokowi sdh direncanakan sejak 2019 utk mempengaruhi JKW agar jln dia menuju RI 1 mulus dgn paket komplit @gibran_tweet",0,0,0,0,in,1606687897314557954,1718058830633046370,susanjun06,https://twitter.com/susanjun06/status/1718392067582574921,brosist2045 temanduit kya40697200 yunartowijaya rencana si botak tugas si culik prabowo utk jebak ganjarpranowo jangan2 gabung si culik perintah jokowi sdh rencana 2019 utk pengaruh jkw jln tuju ri 1 mulus dgn paket komplit gibran tweet,neutral,0.7512021660804749,neutral,0.725883424282074
416,Sat Oct 28 22:19:18 +0000 2023,1718392022195986828,@Chaves1305 @aniesbaswedan Lhaa emng bner kok  Lu yg mlh provokasi  Bner lo itu...dgn dia ngmng gt.  Prabowo blh nyalon berkali2 Gibran bisa nyalon lwat bntuan pamannya Ap slhnya,0,0,0,1,in,875669738,1718172494681776409,ginanjarfindana,https://twitter.com/ginanjarfindana/status/1718392022195986828,chaves1305 aniesbaswedan lhaa emng bner lu yg mlh provokasi bner lo dgn ngmng gt prabowo blh nyalon berkali2 gibran nyalon lwat bntuan paman ap slhnya,neutral,0.9545129537582397,negative,0.9610099792480469
417,Sat Oct 28 22:18:44 +0000 2023,1718391877190475832,"@prabowoisme Mantabnya Ayahbowo, yakin tokoh muda memiliki tingkat semangat yg tinggi untuk menjawab problem dan pekerjaan yang rumit.  BanyakDeklarasi MasbowoGibran Waktunya Anak Muda Tampil  #AkuRelawanPrabowoGibran @prabowo @gerindra",0,0,0,0,in,1713187947993034752,1697059297728049411,nissa_fauzii,https://twitter.com/nissa_fauzii/status/1718391877190475832,prabowoisme mantabnya ayahbowo tokoh muda milik tingkat semangat yg problem kerja rumit banyakdeklarasi masbowogibran anak muda tampil akurelawanprabowogibran prabowo gerindra,positive,0.9811729788780212,positive,0.7372798919677734
418,Sat Oct 28 22:18:36 +0000 2023,1718391843124294141,@Chaves1305 @prabowo Ank ayah kok tolol sih..,0,0,0,0,in,1263593674463535105,1718135433744515244,Al_lHafidz29,https://twitter.com/Al_lHafidz29/status/1718391843124294141,chaves1305 prabowo ank ayah tolol sih,neutral,0.9973402619361877,negative,0.9975559711456299
419,Sat Oct 28 22:17:30 +0000 2023,1718391566602223764,@Dennysiregar7 Engga ada malu karena bukan bagian dari reformasi dulu. Reformasi byk yg hilang termasuk yg diculik oleh Tim Mawar bentukan Prabowo,0,0,0,0,in,1630462476491038720,1717895030596304982,Fernand59844481,https://twitter.com/Fernand59844481/status/1718391566602223764,dennysiregar7 engga malu reformasi reformasi byk yg hilang masuk yg culik tim mawar bentuk prabowo,negative,0.7920679450035095,negative,0.9928508996963501
420,Sat Oct 28 22:17:08 +0000 2023,1718391476760293459,"@kartarahardja Pendukung Jokowi yang baru gabung, soal nya dulu pendukung  prabowo,   Pendukung jokowi itu dari dulu selalu memantengi apapun kerjaan Jokowi, ucapannya, bahkan gestur tubuhnya...tetapi begitu dia memberikan Jalan Tol untuk anaknya, pendukung nya menasehati, tapi ga digubris",0,1,0,0,in,2248413540,1718172417896628306,Gapazhe,https://twitter.com/Gapazhe/status/1718391476760293459,kartarahardja dukung jokowi gabung nya dukung prabowo dukung jokowi memantengi kerja jokowi gestur tubuh jalan tol anak dukung nya nasehat ga gubris,neutral,0.9535658955574036,negative,0.5673858523368835
421,Sat Oct 28 22:17:07 +0000 2023,1718391472087851103,Prabowo Lirik Rudal Buatan Kampus Muhammadiyah di Yogyakarta - CNN Indonesia https://t.co/366FSmnrXw #Jokowinomics #MenataMasaDepan #PrabowoPetugasRakyat,0,0,7,0,in,4579831158,1718391472087851103,ChairudinN6548,https://twitter.com/ChairudinN6548/status/1718391472087851103,prabowo lirik rudal kampus muhammadiyah yogyakarta cnn indonesia jokowinomics menatamasadepan prabowopetugasrakyat,neutral,0.9996873140335083,neutral,0.9959646463394165
422,Sat Oct 28 22:16:53 +0000 2023,1718391412188930193,@prabowoisme Ayahbowo percaya Masgibran seorang tokoh muda yg mampu lebih open ketika mempertimbangkan bermacam arah pemikiran.  BanyakDeklarasi MasbowoGibran Waktunya Anak Muda Tampil  #AkuRelawanPrabowoGibran @prabowo @gerindra https://t.co/JtyRgMC6qn,0,0,0,0,in,1713185005613338624,1718119053460668787,LianaLinni,https://twitter.com/LianaLinni/status/1718391412188930193,prabowoisme ayahbowo percaya masgibran orang tokoh muda yg open timbang arah pikir banyakdeklarasi masbowogibran anak muda tampil akurelawanprabowogibran prabowo gerindra,positive,0.9813790321350098,neutral,0.8377955555915833
423,Sat Oct 28 22:16:48 +0000 2023,1718391390533718506,"@seruanhl @bahlillahadalia @ch_chotimah2 @03__nakula @Aryprasetyo85 @AntoniusCDN @B3doel___ @B1nt4ng_K1r4r4 @BiLLRaY2019 @Eil_Thia @NgkongRoses @RenaHoston178 Aturan ini berlaku juga untuk anak Puan, kalau tahun 2029 mau jadi calon presiden/calon wapres. Maka pendukung Ganjar beda lagi narasinya. Intinya kalian takut kalah dengan Prabowo maka dibangun narasi2 mengubah aturan sesuai kemauan Jokowi. https://t.co/zmH0qfNkde",0,1,1,0,in,2549499816,1718322795988529214,SuryaWira88,https://twitter.com/SuryaWira88/status/1718391390533718506,seruanhl bahlillahadalia ch chotimah2 03 nakula aryprasetyo85 antoniuscdn b3doel b1nt4ng k1r4r4 billray2019 eil thia ngkongroses renahoston178 atur laku anak puan 2029 calon presiden calon wapres dukung ganjar beda narasi inti takut kalah prabowo bangun narasi2 ubah atur sesuai jokowi,negative,0.9991851449012756,neutral,0.9159619808197021
424,Sat Oct 28 22:16:44 +0000 2023,1718391373609791710,@Abaaah Tapi kok bisa nya @SBYudhoyono @AgusYudhoyono @PDemokrat @prabowo @ganjarpranowo ingin melanjutkan program 2 @jokowi 😂😂😂😂😂😂,0,0,0,0,in,1603626819898331136,1662022850205859841,denihartono513,https://twitter.com/denihartono513/status/1718391373609791710,abaaah nya sbyudhoyono agusyudhoyono pdemokrat prabowo ganjarpranowo program 2 jokowi,neutral,0.999639630317688,neutral,0.9845798015594482
425,Sat Oct 28 22:16:09 +0000 2023,1718391228260360265,@H4T14K4LN4L42 @prabowo Semoga ICW dan MAKI mengusut nya,0,0,0,1,in,1383808773102264323,1718309805717324270,DeddyKusdedi3,https://twitter.com/DeddyKusdedi3/status/1718391228260360265,h4t14k4ln4l42 prabowo moga icw maki usut nya,neutral,0.9996942281723022,neutral,0.9224701523780823
426,Sat Oct 28 22:15:57 +0000 2023,1718391176536240189,"@H4T14K4LN4L42 @prabowo @gibran_tweet Tidak mau ketipu yg ke 2x lah.., Rakyat disuruh pegang Kartu Pra Kerja, yg kerja malah TKA Tiongkok.",0,0,0,0,in,1353382850255458305,1718295017700401654,Sugik_Zigzag,https://twitter.com/Sugik_Zigzag/status/1718391176536240189,h4t14k4ln4l42 prabowo gibran tweet tipu yg 2x rakyat suruh pegang kartu pra kerja yg kerja tka tiongkok,neutral,0.9995306730270386,negative,0.7428413033485413
427,Sat Oct 28 22:15:21 +0000 2023,1718391027986489790,"Untuk para Korban dan keluarga dari kasus Pelanggaran HAM berat di Indonesia, termasuk Papua sebaiknya mendukung Prabowo Subianto menjadi Presiden Republik Indonesia, karena yang harus bertanggungjawab atas kasus pelanggaran HAM berat adalah Negara.",0,0,0,0,in,705368198753878016,1718391027986489790,matius_murib,https://twitter.com/matius_murib/status/1718391027986489790,korban keluarga langgar ham berat indonesia masuk papua dukung prabowo subianto presiden republik indonesia bertanggungjawab langgar ham berat negara,neutral,0.999509334564209,neutral,0.9514915347099304
428,Sat Oct 28 22:15:04 +0000 2023,1718390955152462109,@NichNach8 @AzadiRio @tjitrosoenarjo1 Bicara prabowo tdk ada yg di banggakan dgn perbandingan saat itu  Militer kopassus 👎👎👎 Jabatan nya di dukung oleh kekuatan keluarga nya dan juga Suharto  Kemenhan 👎👎👎 Bikin perusahaan dgn anggota dari kader Gerindra untuk mengelola keuangan  Dpt Komisi = korupsi,0,0,0,0,in,1672906446248513537,1718084121464025378,Erdi36913,https://twitter.com/Erdi36913/status/1718390955152462109,nichnach8 azadirio tjitrosoenarjo1 bicara prabowo tdk yg bangga dgn banding militer kopassus jabat nya dukung kuat keluarga nya suharto kemenhan bikin usaha dgn anggota kader gerindra kelola uang dpt komisi korupsi,neutral,0.9165302515029907,neutral,0.892921507358551
429,Sat Oct 28 22:14:35 +0000 2023,1718390834234814708,"@prabowoisme Bener2 asik, Ayahbowo tahu generasi muda memiliki keberanian untuk mengambil risiko dan menyelesaikan permasalahan dengan keyakinan diri.  BanyakDeklarasi MasbowoGibran Waktunya Anak Muda Tampil  #AkuRelawanPrabowoGibran @prabowo @gerindra",0,0,0,0,in,1713185400125288448,1718119053460668787,RsysnaVinka,https://twitter.com/RsysnaVinka/status/1718390834234814708,prabowoisme bener2 asik ayahbowo generasi muda milik berani ambil risiko selesai banyakdeklarasi masbowogibran anak muda tampil akurelawanprabowogibran prabowo gerindra,positive,0.9984246492385864,positive,0.9549716114997864
430,Sat Oct 28 22:14:32 +0000 2023,1718390820456554824,"@AndreasSolusi @ganjarpranowo @prabowo @jokowi @gibran_tweet Halahhhh sok sok an lu, lu gk inget apa dulu pak jokowi di bilang pki lah plonga plongo lah, bahkan ada yg membuat meme yg akhirnya masuk penjara, lu kok diem aja, giliran di senggol dikit, nangis, cemen lu",0,0,0,0,in,818073306670604289,1718088873795002660,wignyo_sinyo007,https://twitter.com/wignyo_sinyo007/status/1718390820456554824,andreassolusi ganjarpranowo prabowo jokowi gibran tweet halahhhh sok sok an lu lu gk inget jokowi bilang pki plonga plongo yg meme yg masuk penjara lu diem aja gilir senggol dikit nang cemen lu,negative,0.9918726086616516,negative,0.9951385259628296
431,Sat Oct 28 22:14:23 +0000 2023,1718390781508276627,"Yenny Wahid Pilih Dukung Ganjar-Mahfud, Nusron Wahid: InsyaAllah Prabowo Jadi Presiden Sesuai Kata Gus Dur https://t.co/UybYbzpRRl",3,13,15,19,in,887743587579944960,1718390781508276627,OposisiCerdas,https://twitter.com/OposisiCerdas/status/1718390781508276627,yenny wahid pilih dukung ganjar mahfud nusron wahid insyaallah prabowo presiden sesuai gus dur,neutral,0.9996650218963623,neutral,0.9937530159950256
432,Sat Oct 28 22:13:41 +0000 2023,1718390604835762645,"Anies-Muhaimin menggunakan frasa ”8 Jalan Perubahan” sebagai misi bakal capres-cawapres. Adapun  Ganjar-Mahfud memilih ”8 Gerak Cepat Ganjar Pranowo &amp  Mahfud MD”, sedangkan Prabowo-Gibran memakai frasa ”Asta Cita #Polhuk #AdadiKompas   https://t.co/lIJt3W8dkd""",0,0,0,0,in,771030588,1718390604835762645,KompasData,https://twitter.com/KompasData/status/1718390604835762645,anies muhaimin frasa 8 jalan ubah misi capres cawapres ganjar mahfud pilih 8 gerak cepat ganjar pranowo amp mahfud md prabowo gibran pakai frasa asta cita polhuk adadikompas,neutral,0.9995902180671692,neutral,0.9969449639320374
433,Sat Oct 28 22:12:54 +0000 2023,1718390410446504263,@TyoGreack @KompasTV Kenapa ga ke prabowo gibran ya?,0,1,0,0,in,1263432719423336449,1718261227313561798,jinjaneo,https://twitter.com/jinjaneo/status/1718390410446504263,tyogreack kompastv ga prabowo gibran,neutral,0.9996829032897949,neutral,0.9964123368263245
434,Sat Oct 28 22:12:21 +0000 2023,1718390271787053354,@prabowoisme Ayahbowo percaya Masgibran seorang pemimpin muda yg bisa lebih open dalam mengkalkulasi berbagai sudut pemikiran.  BanyakDeklarasi MasbowoGibran Waktunya Anak Muda Tampil  #AkuRelawanPrabowoGibran @prabowo @gerindra,0,0,0,0,in,1713179175849488384,1718119053460668787,laura_salsha,https://twitter.com/laura_salsha/status/1718390271787053354,prabowoisme ayahbowo percaya masgibran orang pimpin muda yg open kalkulasi sudut pikir banyakdeklarasi masbowogibran anak muda tampil akurelawanprabowogibran prabowo gerindra,positive,0.929969310760498,neutral,0.8755029439926147
435,Sat Oct 28 22:12:20 +0000 2023,1718390267823501404,Capres Gama @ganjarpranowo @mohmahfudmd  sibuk klarifikasi ke @kikysaputrii   jleb tenan Capres Jendral @prabowo  @gibran_tweet  sibuk klarifikasi .. gak peduli anak siapa yg penting anak muda cawapres . 😳 ah masaaa Capres Amin @aniesbaswedan @cakimiNOW sibuk Olah raga  🤣,0,2,3,19,in,78392421,1718390267823501404,GibraltarNc,https://twitter.com/GibraltarNc/status/1718390267823501404,capres gama ganjarpranowo mohmahfudmd sibuk klarifikasi kikysaputrii jleb tenan capres jendral prabowo gibran tweet sibuk klarifikasi gak peduli anak yg anak muda cawapres ah masaaa capres amin aniesbaswedan cakiminow sibuk olah raga,neutral,0.992438793182373,negative,0.9430643320083618
436,Sat Oct 28 22:12:09 +0000 2023,1718390219488268716,"@hc_poirot Ini yang dinamakan ilmu orang solo kata Prabowo"" https://t.co/TCwVzxdOIG""",0,0,0,1,in,1657175017959088128,1718280345072894062,Ibrahim03568145,https://twitter.com/Ibrahim03568145/status/1718390219488268716,hc poirot nama ilmu orang solo prabowo,neutral,0.9996728897094727,neutral,0.8756365776062012
437,Sat Oct 28 22:11:10 +0000 2023,1718389971986612427,"Semakin pagi semakin berpikir, benar kata teman “pemilu cuma ada 3 AmIN, pak prabowo atau golput” Turu ae met pagi 🙌",0,0,0,0,in,1076937628241424384,1718389971986612427,kaspoww,https://twitter.com/kaspoww/status/1718389971986612427,pagi pikir teman milu 3 amin prabowo golput turu ae met pagi,neutral,0.999545156955719,negative,0.8981043696403503
438,Sat Oct 28 22:10:49 +0000 2023,1718389884262785439,"@Syarman59 @jokowi @prabowo @SBYudhoyono Betul! Stlh top, Anggap remeh banget PDIP, teman2 iring bergantian ke tiap kelurahan, blm ada itu Projo. Hingga Ujung komp.Tahu &amp tempe Kopti Kel. Setu, Lobangbuaya, Cakung dll. Kini justru ngentutin. Sopan",0,0,0,1,in,948751735392120832,1718151855833018493,Rfadlis1,https://twitter.com/Rfadlis1/status/1718389884262785439,syarman59 jokowi prabowo sbyudhoyono stlh top anggap remeh banget pdip teman2 iring ganti lurah blm projo ujung komp amp tempe kopti kel setu lobangbuaya cakung ngentutin sopan,neutral,0.9766527414321899,negative,0.8351797461509705
439,Sat Oct 28 22:10:25 +0000 2023,1718389782982857163,"@BangPakat @willsarana Setuju bang pakat, jokowi masa lalu.. masa depan ya pak ganjar, pak anies ato pak prabowo..",0,0,0,0,in,426444880,1718260232525381656,pimenimiklegi,https://twitter.com/pimenimiklegi/status/1718389782982857163,bangpakat willsarana tuju bang pakat jokowi ganjar anies ato prabowo,neutral,0.9997084736824036,neutral,0.9795902967453003
440,Sat Oct 28 22:10:03 +0000 2023,1718389694168449507,"Lahan dikasih KLHK, land clearing oleh PUPR, kajian tanah &amp  pembibitan oleh kementan + bappenas, penyediaan bibit oleh kementan, anggaran dipegang kementan, kemenhan sebagai enabler. Kerjaan lintas kementerian yg disalahin prabowo. emang anies sukses di dki? banyak gagalnya jg",0,2,0,4,in,93199886,1718389694168449507,klipfahri,https://twitter.com/klipfahri/status/1718389694168449507,lahan kasih klhk land clearing pupr kaji tanah amp bibit tan bappenas sedia bibit tan anggar pegang tan kemenhan enabler kerja lintas menteri yg disalahin prabowo emang anies sukses dki gagal jg,neutral,0.999657154083252,neutral,0.5397782325744629
441,Sat Oct 28 22:10:02 +0000 2023,1718389690301309394,"Bp @jokowi &amp  Bp @prabowo menurut saya,SALAH PERHITUNGAN ... Sehebat apapun Bp @jokowi membangun infrastruktur TDK AKAN mendpt simpati RAKYAT jk dikaitkan dgn PENGKHIANATAN,apalagi @prabowo dikaitkan dgn PENCULIKAN maka lengkaplah AMARAH RAKYAT. NILA SETITIK RUSAK SUSU SEBELANGA",0,1,2,5,in,1405136994288619529,1718389690301309394,Darkie72006006,https://twitter.com/Darkie72006006/status/1718389690301309394,bp jokowi amp bp prabowo salah hitung hebat bp jokowi bangun infrastruktur tdk mendpt simpati rakyat jk kait dgn khianat prabowo kait dgn culi lengkap amarah rakyat nila titik rusak susu belanga,negative,0.9990130662918091,negative,0.9932413101196289
442,Sat Oct 28 22:09:45 +0000 2023,1718389616376758535,@VIVAcoid Si @prabowo gak dianggep min? Nnton 100% komen pada negatif lu bran @gibran_tweet ... Aku yo kcewa c sbg wong solo....yo terus2no leeee,0,0,0,1,in,1628901472321835008,1718237321202672025,EkoApan,https://twitter.com/EkoApan/status/1718389616376758535,vivacoid si prabowo gak dianggep min nnton 100 komen negatif lu bran gibran tweet yo kcewa c sbg solo yo terus2no leeee,negative,0.9970278143882751,negative,0.9863485097885132
443,Sat Oct 28 22:09:43 +0000 2023,1718389606876578223,@Ramez17Ramez @Paltiwest Gw bilang Gibran bukan Prabowo.,0,5,0,1,in,949461440,1718262872697176392,ahmadyan83,https://twitter.com/ahmadyan83/status/1718389606876578223,ramez17ramez paltiwest gw bilang gibran prabowo,neutral,0.999658465385437,neutral,0.9709250330924988
444,Sat Oct 28 22:09:01 +0000 2023,1718389431537914185,"@prabowoisme Setuju asik, Ayahbowo memahami pemuda memiliki keberanian dalam menyelesaikan risiko dan menyelesaikan tantangan dengan keyakinan diri.  BanyakDeklarasi MasbowoGibran Waktunya Anak Muda Tampil  #AkuRelawanPrabowoGibran @prabowo @gerindra",0,0,0,0,in,1713177675773493248,1718119053460668787,RatuKeisya91281,https://twitter.com/RatuKeisya91281/status/1718389431537914185,prabowoisme tuju asik ayahbowo paham pemuda milik berani selesai risiko selesai tantang banyakdeklarasi masbowogibran anak muda tampil akurelawanprabowogibran prabowo gerindra,positive,0.9953120946884155,neutral,0.9482815861701965
445,Sat Oct 28 22:08:49 +0000 2023,1718389380191273109,"@geloraco 9 tahun lalu, bapak kandung cawapres anda berjanji hal yg sama, tdk akan impor ini dan itu. Kenyataan nya? PHP  Tetapi saya tetap berdo'a agar next presiden bisa melakukan kemandirian dlm bidang pangan, energi dll @prabowo @aniesbaswedan @ganjarpranowo",0,0,0,0,in,1715707462576476160,1718266960448999712,elde_barge123,https://twitter.com/elde_barge123/status/1718389380191273109,geloraco 9 kandung cawapres janji yg tdk impor nyata nya php berdo a next presiden laku mandiri dlm bidang pangan energi prabowo aniesbaswedan ganjarpranowo,neutral,0.9995852112770081,neutral,0.9896252751350403
446,Sat Oct 28 22:08:48 +0000 2023,1718389377066586373,"Anies-Muhaimin menggunakan frasa ”8 Jalan Perubahan” sebagai misi bakal capres-cawapres. Adapun  Ganjar-Mahfud memilih ”8 Gerak Cepat Ganjar Pranowo &amp  Mahfud MD”, sedangkan Prabowo-Gibran memakai frasa ”Asta Cita #Polhuk #AdadiKompas   https://t.co/92oHlGO405""",1,2,2,8,in,255866913,1718389377066586373,hariankompas,https://twitter.com/hariankompas/status/1718389377066586373,anies muhaimin frasa 8 jalan ubah misi capres cawapres ganjar mahfud pilih 8 gerak cepat ganjar pranowo amp mahfud md prabowo gibran pakai frasa asta cita polhuk adadikompas,neutral,0.9995902180671692,neutral,0.9969449639320374
447,Sat Oct 28 22:08:33 +0000 2023,1718389315322135018,"VIDEO Momen Kaesang Buka Puasa saat Adzan Magrib, Hentikan Konferensi Pers dengan Prabowo - https://t.co/RNwxalBl5f https://t.co/yPZu3wvXf6 #Jokowinomics #MenataMasaDepan #PrabowoPetugasRakyat",0,0,10,0,in,4580053393,1718389315322135018,KasimS3654,https://twitter.com/KasimS3654/status/1718389315322135018,video momen kaesang buka puasa adzan magrib henti konferensi pers prabowo jokowinomics menatamasadepan prabowopetugasrakyat,neutral,0.9996405839920044,neutral,0.9926363229751587
448,Sat Oct 28 22:08:33 +0000 2023,1718389314604953769,"VIDEO Momen Kaesang Buka Puasa saat Adzan Magrib, Hentikan Konferensi Pers dengan Prabowo - https://t.co/uKUesTyOQs https://t.co/XZaYAovMtv #Jokowinomics #MenataMasaDepan #PrabowoPetugasRakyat",0,0,10,0,in,4195501453,1718389314604953769,mehuli_ginting,https://twitter.com/mehuli_ginting/status/1718389314604953769,video momen kaesang buka puasa adzan magrib henti konferensi pers prabowo jokowinomics menatamasadepan prabowopetugasrakyat,neutral,0.9996405839920044,neutral,0.9926363229751587
449,Sat Oct 28 22:07:57 +0000 2023,1718389163459051964,@HusinShihab @prabowo @kikysaputrii Takut diculik🤣,0,1,0,0,in,2463167359,1718312101398380732,jane_ritonga,https://twitter.com/jane_ritonga/status/1718389163459051964,husinshihab prabowo kikysaputrii takut culik,negative,0.9982312321662903,negative,0.7441812753677368
450,Sat Oct 28 22:07:57 +0000 2023,1718389163056402576,"Gubernur Jakarta, Anies Baswedan Bakal Jadi Pesaing Prabowo Subianto  Di Pilpres 2024. - Rico Marbun Direktur Eksekutif Median Jum'at (16/10/2020) . https://t.co/wUqribXkSN . https://t.co/E9nKuPDZfk",0,6,9,55,in,1603638553820684289,1718389163056402576,cobeh2022,https://twitter.com/cobeh2022/status/1718389163056402576,gubernur jakarta anies baswedan saing prabowo subianto pilpres 2024 rico marbun direktur eksekutif median jum at 16 10 2020,neutral,0.999692440032959,neutral,0.9978440999984741
451,Sat Oct 28 22:07:43 +0000 2023,1718389105871228976,@kikysaputrii Gw pingin liat Lo ngeroasting pak Prabowo Ki... tanya dah sepuas Lo kenapa Ampe pak Prabowo pindah k Yordania,0,0,0,0,in,1376558427342704641,1718117122134708637,Gembel83522575,https://twitter.com/Gembel83522575/status/1718389105871228976,kikysaputrii gw pingin liat lo ngeroasting prabowo ki dah puas lo ampe prabowo pindah k yordania,positive,0.7593942880630493,positive,0.6577710509300232
452,Sat Oct 28 22:07:13 +0000 2023,1718388977500369399,"@5t3v3n_P3g3L Gaya pendukung Kampret dari dulu seperti itu, selalu memotong orang ngomong, agar apa yang dibicarakan orang tidak didengar audiens, haduhhhhh Begitulah kira2 kwalitas pendukung Prabowo",0,0,0,0,in,2248413540,1718220841601913281,Gapazhe,https://twitter.com/Gapazhe/status/1718388977500369399,5t3v3n p3g3l gaya dukung kampret potong orang ngomong bicara orang dengar audiens haduhhhhh kira2 kwalitas dukung prabowo,negative,0.9994088411331177,negative,0.9937136769294739
453,Sat Oct 28 22:07:09 +0000 2023,1718388961553609207,"@kikysaputrii padahal kiky pendukung bu @susipudjiastuti 🤣🤣🤣🤣 buzzer aneh, kemaren dulu bilang anies, sekarang prabowo, 😅🥲",0,0,0,0,in,1548709293066633216,1718268627416457447,Be3ferdyan,https://twitter.com/Be3ferdyan/status/1718388961553609207,kikysaputrii kiky dukung bu susipudjiastuti buzzer aneh kemaren bilang anies prabowo,neutral,0.9995777010917664,neutral,0.50306636095047
454,Sat Oct 28 22:07:05 +0000 2023,1718388944235282882,"@tinggipasaribu @GunRomli @SBYudhoyono @TeddGus @alextham878 @Lembayung071 @bengkeldodo @kurawa @datuakrajoangek @99propaganda @jokowi @gibran_tweet @kaesangp Emang prabowo mau diroasting?, mana berani, takutnya nanti gebrak meja, atau dilempar sama asbak. https://t.co/aNyO724Avg""",0,1,0,0,in,1634448319111114753,1708655498613145692,PutraPe24992947,https://twitter.com/PutraPe24992947/status/1718388944235282882,tinggipasaribu gunromli sbyudhoyono teddgus alextham878 lembayung071 bengkeldodo rawa datuakrajoangek 99propaganda jokowi gibran tweet kaesangp emang prabowo diroasting berani takut gebrak meja lempar asbak,neutral,0.9877082109451294,neutral,0.9826726913452148
