,created_at,id_str,full_text,quote_count,reply_count,retweet_count,favorite_count,lang,user_id_str,conversation_id_str,username,tweet_url,clean_text,label,score,label_bert,score_bert
0,Sat Oct 28 23:59:49 +0000 2023,1718417315702972432,@EAAANNH @zone1_war @savicali @NUgarislucu LSI bilang Tingkat Kepuasan Publik ke Jokowi 90 persen.. Indikator 80 persen lebih 🤣🤣🤣🤣 lah di survey sama pemilih anies 21-25 persenan belum lagi pro prabowo yg masih anti jokowi kyk fans dewa 30 persen..sekalian ambil margin of error + angka oposisi 🤣 YANG PERCAYA KOCAK 🤣,0,0,0,0,in,1714893544614416384,1718220830520611299,jobirganjar,https://twitter.com/jobirganjar/status/1718417315702972432,eaaannh zone1 war savicali nugarislucu lsi bilang tingkat puas publik jokowi 90 persen indikator 80 persen survey pilih anies 21 25 persen pro prabowo yg anti jokowi kyk fans dewa 30 persen ambil margin of error angka oposisi percaya kocak,neutral,0.9876430034637451,negative,0.9239157438278198
1,Sat Oct 28 23:59:03 +0000 2023,1718417124132290902,@ata0923 @PartaiSocmed Apalagi Demokrat. Skalipun saat ntu Nasdem udah mulai sowanan ama PKS n saat ntu kejadiannya setelah Nasdem ama Anies makan siang yang disaat bersamaan Mega ama Prabowo masak nasi goreng. Dulu Nasdem blom ada pertimbangan mo usung Anies bener2. Makanya kek Irma Chaniago gedeg,0,0,0,0,in,2862109627,1718287042277159154,FelixSGL1,https://twitter.com/FelixSGL1/status/1718417124132290902,ata0923 partaisocmed demokrat skalipun ntu nasdem udah sowan ama pks n ntu nasdem ama anies makan siang mega ama prabowo masak nasi goreng nasdem blom timbang mo usung anies bener2 kek irma chaniago gedeg,neutral,0.9996102452278137,neutral,0.8317493200302124
2,Sat Oct 28 23:58:52 +0000 2023,1718417077797826860,"@Dennysiregar7 Kalau bagi saya, Pilpres tahun 2024 adalah unik, dua kandidat yang membingungkan, Ganjar Mahfud APA Prabowo Gibran, tapi aku tetap memilih Ganjar Mahfud",0,0,0,0,in,1519250397747347456,1716833023176610007,JudokoS,https://twitter.com/JudokoS/status/1718417077797826860,dennysiregar7 pilpres 2024 unik kandidat bingung ganjar mahfud prabowo gibran pilih ganjar mahfud,neutral,0.9992368221282959,neutral,0.9957749247550964
3,Sat Oct 28 23:58:16 +0000 2023,1718416928245739951,"@mihrabku Kampanye pilpres 2019, Di banyak tempat kampanye Prabowo Sandi juga membludak audiennya, sebaliknya Jokowi Makruf lebih banyak ditemukan audien artifisial..  Kenyataannya.. yg disahkan yang kampanyenya lebih sepi.",0,0,0,0,in,87234890,1718236742162202790,alpha_n,https://twitter.com/alpha_n/status/1718416928245739951,mihrab kampanye pilpres 2019 kampanye prabowo sandi membludak audiennya jokowi makruf temu audien artifisial nyata yg sah kampanye sepi,negative,0.999538779258728,negative,0.9409107565879822
4,Sat Oct 28 23:58:02 +0000 2023,1718416868795650475,Prabowo dan Budiman Bakal Satu Panggung Acara Nasional Pekan Depan - CNN Indonesia https://t.co/lZzNTzjXUz #Jokowinomics #MenataMasaDepan #PrabowoPetugasRakyat,0,0,9,0,in,795445014864203777,1718416868795650475,AzhareAkiba,https://twitter.com/AzhareAkiba/status/1718416868795650475,prabowo budiman panggung acara nasional pekan cnn indonesia jokowinomics menatamasadepan prabowopetugasrakyat,neutral,0.9996298551559448,neutral,0.9937937259674072
5,Sat Oct 28 23:57:58 +0000 2023,1718416851812925621,@sigitwid kalo yg paling sepuh tentu pak Prabowo ( kalau jadi ) juara kalau versi Indonesia,0,0,0,0,in,1699041575593250816,1717896385037807907,BennyGabee,https://twitter.com/BennyGabee/status/1718416851812925621,sigitwid kalo yg sepuh prabowo juara versi indonesia,neutral,0.9971460700035095,positive,0.8984026312828064
6,Sat Oct 28 23:57:55 +0000 2023,1718416838458216787,"@YRadianto Bukan cara menikmati kalimatnya mungkin ya, tapa cara mendapatkan untuk jadi cawapres prabowo.. Sampuun..",0,0,0,0,in,1656499880515506178,1718272693219537289,uaswahan89,https://twitter.com/uaswahan89/status/1718416838458216787,yradianto nikmat kalimat tapa cawapres prabowo sampuun,neutral,0.9893293976783752,positive,0.8707991242408752
7,Sat Oct 28 23:57:42 +0000 2023,1718416783705874504,"@Paltiwest bobby juga terpaksa dukung prabowo gibran, karena kalo sampe berlawanan you know lah, pasti bakal dikucilin di keluarga, brengsek emang tuh mas-mas tukang es teh solo😀🤌",0,0,0,0,in,1466707969576366082,1718404628088512819,tyoojani,https://twitter.com/tyoojani/status/1718416783705874504,paltiwest bobby paksa dukung prabowo gibran kalo sampe lawan you know dikucilin keluarga brengsek emang tuh mas mas tukang es teh solo,negative,0.9997463822364807,negative,0.996119499206543
8,Sat Oct 28 23:57:37 +0000 2023,1718416763317338200,@AzzamIzzulhaq @aniesbaswedan @cakimiNOW @susipudjiastuti @prabowo Pak Anis sdh pernah sowan ke beliau bg,0,0,0,0,in,1586367067250642944,1717867229822505348,a_mwandi,https://twitter.com/a_mwandi/status/1718416763317338200,azzamizzulhaq aniesbaswedan cakiminow susipudjiastuti prabowo anis sdh sowan beliau bg,neutral,0.9997212290763855,neutral,0.9928324222564697
9,Sat Oct 28 23:57:35 +0000 2023,1718416752986755112,@yoggii_e @tempodotco jangankan dinasti. pernah prabowo bilang korupsi kalau dikit gpp,0,0,0,0,in,1651925923334356992,1716863776304345336,tamanakalcom,https://twitter.com/tamanakalcom/status/1718416752986755112,yoggii e tempodotco dinasti prabowo bilang korupsi dikit gpp,neutral,0.9919617772102356,negative,0.8102858066558838
10,Sat Oct 28 23:57:31 +0000 2023,1718416737694331204,"@RijhondhyS @prabowo @adearmando61 @AlmaghribiS @are_inismyname @BANGSAygSUJUD @bengkeldodo @Chaves1305 @EllyKoro @gananjaya @gibran_tweet @Kimberley_2024 Ayah @prabowo Calon Pemimpin Hebat, berkali kali tumbang tak kenal gentar, Indonesia butuh pemimpin seperti Ayah, Orang2 yg slalu bertahan berjuang bersama Ayah, mereka adalah Pemenang Sbb Mreka memilih ttap berdiri diatas Prinsip dn tdk akn menghianati Prinsip. Itulah Pejuang.",0,1,0,1,in,1660885617306406912,1718248798487732569,zaqila959,https://twitter.com/zaqila959/status/1718416737694331204,rijhondhys prabowo adearmando61 almaghribis are inismyname bangsaygsujud bengkeldodo chaves1305 ellykoro gananjaya gibran tweet kimberley 2024 ayah prabowo calon pimpin hebat kali kali tumbang kenal gentar indonesia butuh pimpin ayah orang2 yg slalu tahan juang ayah menang sbb mreka pilih ttap prinsip dn tdk akn menghianati prinsip juang,positive,0.9787108302116394,positive,0.611527144908905
11,Sat Oct 28 23:57:30 +0000 2023,1718416735051899238,@yennywahid @ganjarpranowo Prabowo Gibran presiden baru kita,0,0,0,0,in,1424955995415973889,1718265553247461679,DwiHart08845750,https://twitter.com/DwiHart08845750/status/1718416735051899238,yennywahid ganjarpranowo prabowo gibran presiden,neutral,0.9996733665466309,neutral,0.9956870675086975
12,Sat Oct 28 23:57:28 +0000 2023,1718416723756675085,"@adearmando61 Halah banyak dalih.... Intinya @prabowo dan koalisinya,terutama @psi_id gak percaya diri dan takut kalah,makanya narik² @jokowi dan anak²nya..",0,0,0,0,in,1637199236,1718065825767358747,Whyd801,https://twitter.com/Whyd801/status/1718416723756675085,adearmando61 halah dalih inti prabowo koalisi utama psi id gak percaya takut kalah narik jokowi anak nya,negative,0.5275670886039734,negative,0.9428764581680298
13,Sat Oct 28 23:57:16 +0000 2023,1718416674863624495,@gm_gm 1. Apakah Prabowo punya hubungan keluarga dg gibran?  2. Apakah pak jokowi pengurus gerindra?  3. Apa kriteria untuk nepotisme?,0,0,0,1,in,1685909237501956096,1718268539629683016,sipeyang_,https://twitter.com/sipeyang_/status/1718416674863624495,gm gm 1 prabowo hubung keluarga dg gibran 2 jokowi urus gerindra 3 kriteria nepotisme,neutral,0.9995880722999573,neutral,0.996362030506134
14,Sat Oct 28 23:57:08 +0000 2023,1718416640818430103,"Dan inilah pernyataan Prabowo ttg TUKANG2 SURVEI"" 👇👇👇 https://t.co/mqBlHcwTC5""",0,0,0,0,in,1230274691270492160,1718416640818430103,RadenSetyaki2,https://twitter.com/RadenSetyaki2/status/1718416640818430103,nyata prabowo ttg tukang2 survei,neutral,0.9270531535148621,neutral,0.5736877918243408
15,Sat Oct 28 23:57:07 +0000 2023,1718416635567145141,",,,, kalau putusan MKMK batalkan keputusan MK ttg batasan umur Capres Cawapres , apakah pencalonan Gibran sbg Cawapres dari Prabowo batal ?? (3)",0,3,3,13,in,131814756,1718416631200944633,susno2g,https://twitter.com/susno2g/status/1718416635567145141,putus mkmk batal putus mk ttg batas umur capres cawapres calon gibran sbg cawapres prabowo batal 3,neutral,0.9997032284736633,neutral,0.9911995530128479
16,Sat Oct 28 23:56:54 +0000 2023,1718416580764483673,@xquitavee Sebenarnya pak Prabowo pernah bilang ke pak Jokowi ingin mencalonkan Gibran sebagai cawapres nya tapi pak Jokowi tidak setuju  saat itu   pak Jokowi gak mau nanti disangka aji mumpung kalau gak perca tanya saja langsung ke Prabowo,0,0,0,0,in,1276876868340203520,1718406805200753080,bendolganteng,https://twitter.com/bendolganteng/status/1718416580764483673,xquitavee prabowo bilang jokowi calon gibran cawapres nya jokowi tuju jokowi gak sangka aji mumpung gak perca langsung prabowo,neutral,0.9933898448944092,negative,0.4616389870643616
17,Sat Oct 28 23:56:44 +0000 2023,1718416538523558188,@polentamel @yunartowijaya Nyerang Prabowo old gitu?? Kalo dibilang prabowo young baru nyerang 🤣🤣😭😜,0,0,0,0,in,1324564910911549440,1718058830633046370,Sarinah116,https://twitter.com/Sarinah116/status/1718416538523558188,polentamel yunartowijaya nyerang prabowo old gitu kalo bilang prabowo young nyerang,negative,0.996478259563446,negative,0.9027198553085327
18,Sat Oct 28 23:56:35 +0000 2023,1718416503169810539,"@tempodotco Prabowo seharuanya realistis dlm melakukan penilaian, publik mulai cerdas menyikapi setiap ucapan dari para politikus, jika ingin terpilih prabowo harus mengkritik kebijakan jokowi yg salah secara objektif, prabowo hrs berfikir bagaimana menyelesaikan hutang Indonesia 7, 5 t!!",0,0,0,1,in,615466002,1718414621957374388,jojoe_gaza,https://twitter.com/jojoe_gaza/status/1718416503169810539,tempodotco prabowo seharuanya realistis dlm laku nilai publik cerdas sikap politikus pilih prabowo kritik bijak jokowi yg salah objektif prabowo hrs berfikir selesai hutang indonesia 7 5 t,positive,0.9883682131767273,negative,0.6999443173408508
19,Sat Oct 28 23:56:25 +0000 2023,1718416462208172130,"@TajukPolitik Borok survey bayaran :   Prabowo : Jabar 50.7% dan jatim 36.4%  (emang bisa ??😂😂)  Ganjar : jatim 43.1% dan jateng 63% (emang bisa ? 😂😂)  Anies : Jabar  26.8%, Jatim 15.4%, Jateng 9.2% (banyak ruang menaikkan)  Pantesan elektabilitas survey bayaran prabowo ganjar ringgi 😂 https://t.co/PNGQRvYj07",1,0,2,6,in,1704144445648846848,1718241446875344925,Komentator_baik,https://twitter.com/Komentator_baik/status/1718416462208172130,tajukpolitik borok survey bayar prabowo jabar 50 7 jatim 36 4 emang ganjar jatim 43 1 jateng 63 emang anies jabar 26 8 jatim 15 4 jateng 9 2 ruang pantesan elektabilitas survey bayar prabowo ganjar ringgi,neutral,0.9996328353881836,neutral,0.9774613976478577
20,Sat Oct 28 23:56:15 +0000 2023,1718416416888733913,@kikysaputrii Roasting pak Prabowo tentang tim mawar dong mirs. Kikiy  wirrrrrr😁👌,0,0,0,0,in,1046813487295430657,1718257576901742854,adipurnama1997,https://twitter.com/adipurnama1997/status/1718416416888733913,kikysaputrii roasting prabowo tim mawar mirs kikiy wirrrrrr,neutral,0.9997089505195618,neutral,0.9044758081436157
21,Sat Oct 28 23:55:58 +0000 2023,1718416349318512931,"@Syarman59 @jokowi @prabowo @SBYudhoyono Siap apapun yang sengaja mengobok-obok konstitusi negara sebagai acuan bernegara, bagi saya wajib saya lawan",0,0,0,1,in,1608317053294854144,1718151855833018493,denmaspudji,https://twitter.com/denmaspudji/status/1718416349318512931,syarman59 jokowi prabowo sbyudhoyono sengaja kobok obok konstitusi negara acu negara wajib lawan,neutral,0.9992300271987915,neutral,0.9218542575836182
22,Sat Oct 28 23:55:52 +0000 2023,1718416322172985660,Prabowo Subianto Menegaskan Akan Melanjutkan Program Kerja Presiden Jokowi https://t.co/CEFuNeledS,0,0,0,0,in,1240106903016853504,1718416322172985660,ChakrawalaS,https://twitter.com/ChakrawalaS/status/1718416322172985660,prabowo subianto program kerja presiden jokowi,neutral,0.9997130036354065,neutral,0.9932044744491577
23,Sat Oct 28 23:55:07 +0000 2023,1718416134293401719,Prabowo: Saya Bersaksi Jokowi Sungguh-Sungguh Bekerja demi Rakyat https://t.co/YRlOfqgLgD,0,0,0,0,in,58880688,1718416134293401719,pikiran_rakyat,https://twitter.com/pikiran_rakyat/status/1718416134293401719,prabowo saksi jokowi sungguh sungguh kerja rakyat,positive,0.9995272159576416,positive,0.9770407676696777
24,Sat Oct 28 23:54:42 +0000 2023,1718416029959995424,@seeksixsuck bukannya Ganjar lebih bnyak memenangkan penguna tik tok ketimbang Prabowo...ini sih hasil survei Juli ya,0,1,0,0,in,1605057417384902656,1718308258858111148,FransSimo,https://twitter.com/FransSimo/status/1718416029959995424,seeksixsuck ganjar bnyak menang penguna tik tok ketimbang prabowo sih hasil survei juli,neutral,0.8648537397384644,neutral,0.6741868257522583
25,Sat Oct 28 23:54:31 +0000 2023,1718415983042568261,@adiawae Kayanya soal hutang ke China untuk project strategis yg tidak terkendalikan'. Kreditur punya bargain' besar soal ini. Kreditur lebih melihat persoalan 'personal' (simbol) negara sebagai jaminan atas debitur'. Debitur terjebak permainan ini. Prabowo lebih rasional soal ini,0,0,0,1,in,52040718,1718268736577421406,daitadit,https://twitter.com/daitadit/status/1718415983042568261,adiawae kaya hutang china project strategis yg kendali kreditur bargain kreditur lihat personal simbol negara jamin debitur debitur jebak main prabowo rasional,neutral,0.8177428245544434,negative,0.9851503968238831
26,Sat Oct 28 23:54:15 +0000 2023,1718415915694588364,"@hipohan .  .  kalo benar2 peduli dgn NKRI, Banyak Cawapres anak muda YANG LEBIH BAIK DARI Gibran.  Prabowo mendekati UDZUR/ sepuh.  Apa mau NKRI, kemudian presidennya Gibran ???  awas musibah ! .",0,0,0,0,in,2779743853,1718402916514717815,123Laptop,https://twitter.com/123Laptop/status/1718415915694588364,hipohan kalo benar2 peduli dgn nkri cawapres anak muda gibran prabowo udzur sepuh nkri presiden gibran awas musibah,negative,0.9998143315315247,negative,0.9110910892486572
27,Sat Oct 28 23:54:03 +0000 2023,1718415864796749918,@indralfiansyahh prabowo aj g si,0,1,0,0,in,1252617166022537217,1718291319129604223,ethereals0ull,https://twitter.com/ethereals0ull/status/1718415864796749918,indralfiansyahh prabowo aj g si,neutral,0.9996843338012695,neutral,0.9849239587783813
28,Sat Oct 28 23:54:00 +0000 2023,1718415851001626694,"Wah!!!!! Bagaimana ini @prabowo ? Benarkah?? @tvOneNews  mohon telusuri, agar tidak jadi Fitnah.",0,0,0,0,in,1655787021334630401,1718415851001626694,ahmadalbaroesy,https://twitter.com/ahmadalbaroesy/status/1718415851001626694,prabowo tvonenews mohon telusur fitnah,neutral,0.9744148850440979,negative,0.8000417947769165
29,Sat Oct 28 23:53:39 +0000 2023,1718415765291122877,@GunRomli Wajar dong  qadari pro prabowo,0,0,0,0,in,4112980994,1718413094651838776,AliTirta2,https://twitter.com/AliTirta2/status/1718415765291122877,gunromli wajar qadari pro prabowo,neutral,0.9996945858001709,neutral,0.9955592155456543
30,Sat Oct 28 23:53:32 +0000 2023,1718415736035758300,"@BANGSAygSUJUD @alextham878 @Gi_N0ng @Minietweets_ @Lembayung071 @Ndaxwz @bengkeldodo @P4P4B0W0_2024 @Ndons_Back @Chaves1305 Exercisenya daddy Prabowo mah keren donk n berkelas.👍  Kagak pernah tebar pesona  sambil lari pake legging, maen tik tok'an  &amp  hobi nonton bokepan 🤣 Paraah ...   Beda level men 🥰 https://t.co/wY5Q2mIvkl""",2,17,15,26,in,1329955252913668096,1718403847411122495,mpoklela7,https://twitter.com/mpoklela7/status/1718415736035758300,bangsaygsujud alextham878 gi n0ng minietweets lembayung071 ndaxwz bengkeldodo p4p4b0w0 2024 ndons back chaves1305 exercisenya daddy prabowo mah keren donk n kelas kagak tebar pesona lari pake legging maen tik tok an amp hobi nonton bokepan paraah beda level men,positive,0.9996472597122192,positive,0.8574588298797607
31,Sat Oct 28 23:53:30 +0000 2023,1718415725742985501,@msaid_didu Jijik,0,0,0,0,in,1623180959830138880,1718066118357836168,Prabo1Prabowo,https://twitter.com/Prabo1Prabowo/status/1718415725742985501,msaid didu jijik,negative,0.9998347759246826,negative,0.9977396726608276
32,Sat Oct 28 23:52:50 +0000 2023,1718415557480042634,"@Candra4smara Itungan mereka Gibran yg bakal jadi presiden, mereka bertaruh di umur Prabowo",0,0,0,0,in,21325278,1718311891922219337,devils4dvocate,https://twitter.com/devils4dvocate/status/1718415557480042634,candra4smara itungan gibran yg presiden taruh umur prabowo,neutral,0.9938082098960876,neutral,0.9673117995262146
33,Sat Oct 28 23:52:33 +0000 2023,1718415488697671716,"@OposisiCerdas Si Fahri udah ga jadi anggota DPR dungunya kebangetan pikiranya pendek pula, Coba kalau Prabowo/Gibran jadi pemenang baru itungan bulan Prabowo sakit ngga bisa melanjutkan tugasnya otomatis yg meneruskan Pemerintahan Si Bocil... Ngga kebayang kalo ini terjadi...🙄",0,1,0,3,in,1581602113976950785,1718410026904404163,dedifrozenfood,https://twitter.com/dedifrozenfood/status/1718415488697671716,oposisicerdas si fahri udah ga anggota dpr dungu banget pikiranya pendek coba prabowo gibran menang itungan prabowo sakit ngga tugas otomatis yg perintah si bocil ngga bayang kalo,negative,0.9997817873954773,negative,0.9961125254631042
34,Sat Oct 28 23:52:15 +0000 2023,1718415412503928929,"@vousmonavis @e100ss Banyak oknum sopir truk yg tidak punya etika dan bodoh.....karena mereka nyopir karbitan dalam arti bisanya hanya belok dan injak gas tanpa berpikir haluan, tanpa keahlian dan gak punya SIM.... Mohon yg berwenang utk merazia dan bila perlu pemilik armadanya juga disanksi tegas.",0,0,0,0,in,1623180959830138880,1718098631000228242,Prabo1Prabowo,https://twitter.com/Prabo1Prabowo/status/1718415412503928929,vousmonavis e100ss oknum sopir truk yg etika bodoh nyopir karbitan arti belok injak gas pikir haluan ahli gak sim mohon yg wenang utk razia milik armada sanksi,negative,0.834752082824707,negative,0.9944032430648804
35,Sat Oct 28 23:52:15 +0000 2023,1718415409966354629,@HusinShihab @prabowo @kikysaputrii He hwe Muka jelek cermin dipecah,0,0,0,0,in,710635383139278850,1718312101398380732,chusnulhadiset1,https://twitter.com/chusnulhadiset1/status/1718415409966354629,husinshihab prabowo kikysaputrii he hwe muka jelek cermin pecah,negative,0.9996684789657593,negative,0.9970273375511169
36,Sat Oct 28 23:51:39 +0000 2023,1718415262914138538,"MKMKMKMKMKM... 🤣🤣 Buzzer² Prabowo rame² posting gambar ini dengan narasi seolah pendukung Ganjar menolak pemimpin muda. Kebalik woyy!! Justru kami ingin pilih presiden yang muda, bukan Capres yang udah bangkotan. Kami bukan menolak usianya, tapi menolak pemanfaatan MK sebagai… https://t.co/tkLdqGyo2V",5,41,83,319,in,1101696077147729920,1718415262914138538,03__nakula,https://twitter.com/03__nakula/status/1718415262914138538,mkmkmkmkmkm buzzer prabowo rame posting gambar narasi olah dukung ganjar tolak pimpin muda woyy pilih presiden muda capres udah bangkot tolak usia tolak manfaat mk,neutral,0.9964805245399475,negative,0.9310405254364014
37,Sat Oct 28 23:51:08 +0000 2023,1718415132576072152,@Putri96960977 @CandraF57328229 Semalam Aku bermimpi beliau [Pak Prabowo] meninggal dunia…. Apa ya artinya..? 🤔,0,1,0,0,in,126055346,1718168457395777704,jerrysujari,https://twitter.com/jerrysujari/status/1718415132576072152,putri96960977 candraf57328229 malam mimpi beliau prabowo tinggal dunia arti,neutral,0.9996435642242432,neutral,0.9857521653175354
38,Sat Oct 28 23:50:45 +0000 2023,1718415033439486136,"Bergabungnya Gibran ke Prabowo tak sertamerta naikkan elektabilitas, bahkan justru cenderung menurun. Fenomena apakah ini?? -  https://t.co/K6M7DVeExn via @YouTube",0,0,0,0,in,240551313,1718415033439486136,nurhidayatsardi,https://twitter.com/nurhidayatsardi/status/1718415033439486136,gabung gibran prabowo sertamerta elektabilitas cenderung turun fenomena via youtube,neutral,0.9995531439781189,neutral,0.9974678754806519
39,Sat Oct 28 23:50:44 +0000 2023,1718415030360916342,"@VIVAcoid Jualannya kok Gibran, jualan Prabowo donk, hahhaa Prabowo dah 72 tahun, bentar lagi ketemu 72 bidadari",0,0,0,0,in,2248413540,1718189752426655771,Gapazhe,https://twitter.com/Gapazhe/status/1718415030360916342,vivacoid jual gibran jual prabowo donk hahhaa prabowo dah 72 bentar ketemu 72 bidadari,neutral,0.9952652454376221,neutral,0.9864931702613831
40,Sat Oct 28 23:50:36 +0000 2023,1718414998496751788,"@tvOneNews Sesama kaum pemuja nepotisme saling tertarik satu sama lain 😂🤣 Sukarnoism gusdurism  Bodohnya, itu PDIP nyindir soal jgn pilih yg nepotisme. Dengan maksud nyuruh spy jgn milih prabowo.  Pdhl mah nepotisme ga cuma soal keluarga. Nepotisme itu juga soal teman, saudara jauh.",0,0,0,0,in,778692608,1718202226550993376,akubukanako,https://twitter.com/akubukanako/status/1718414998496751788,tvonenews kaum puja nepotisme tarik sukarnoism gusdurism bodoh pdip nyindir jgn pilih yg nepotisme maksud nyuruh spy jgn milih prabowo pdhl mah nepotisme ga keluarga nepotisme teman saudara,negative,0.9986334443092346,negative,0.9952567219734192
41,Sat Oct 28 23:50:34 +0000 2023,1718414988719849499,Ah anying ini mah butuh seluruh kekayaan Prabowo biar pusing kepala ilang,0,0,0,0,in,1524768203297083394,1718414988719849499,masnextdoor,https://twitter.com/masnextdoor/status/1718414988719849499,ah anying mah butuh kaya prabowo biar pusing kepala ilang,negative,0.9997289776802063,negative,0.9900711178779602
42,Sat Oct 28 23:50:31 +0000 2023,1718414974601887780,@Gojekmilitan 😆😆😆 jalanan depan rumah tuh bang,0,0,0,0,in,158912165,1718333935900578217,JHPrabowo,https://twitter.com/JHPrabowo/status/1718414974601887780,gojekmilitan jalan rumah tuh bang,negative,0.9998169541358948,neutral,0.9420068860054016
43,Sat Oct 28 23:50:13 +0000 2023,1718414901604212903,@Kimberley_2024 @prabowo @99propaganda @alextham878 @Alie_Fahnoor @AlmaghribiS @BANGSAygSUJUD @Bank_Joee_ @Chaves1305 @DarekaRendy samgking ga ada bahan buay kampanye...akhirnya tugas ulama diambil alih sama dia demi pencitraan diri dihadapan para BUIH,0,1,0,4,in,1603758737239396354,1718400825310253526,yusufagro,https://twitter.com/yusufagro/status/1718414901604212903,kimberley 2024 prabowo 99propaganda alextham878 alie fahnoor almaghribis bangsaygsujud bank joee chaves1305 darekarendy samgking ga bahan buay kampanye tugas ulama ambil alih citra hadap buih,neutral,0.9992358684539795,neutral,0.9839003086090088
44,Sat Oct 28 23:50:12 +0000 2023,1718414894545182979,"@Kimberley_2024 gs usah takut dgn doa, klo memang jujur dan tdk dzolim hrsnya ga perlu panik dn Prabowo jg boleh berdoa untuk kemengannya, Tuhan akan slalu brsama orang jujur dn tdak menghalalkn sgala cara, keadilan akan mencari jalannya sendiri yg penting tetap berdoa dn berusaha",0,0,0,0,in,1328174373375643650,1718194730243342712,BagusGenjing16,https://twitter.com/BagusGenjing16/status/1718414894545182979,kimberley 2024 gs takut dgn doa klo jujur tdk dzolim hrsnya ga panik dn prabowo jg doa tuhan slalu brsama orang jujur dn tdak menghalalkn sgala adil cari jalan yg doa dn usaha,negative,0.9981770515441895,positive,0.8955142498016357
45,Sat Oct 28 23:50:10 +0000 2023,1718414888354316399,"@Dennysiregar7 @_Rizmaya__ Percayalah yg penting bukan Anis ,Ganjar boleh Prabowo boleh.",0,0,0,0,in,974299627821309952,1718205044720325037,telojava4,https://twitter.com/telojava4/status/1718414888354316399,dennysiregar7 rizmaya percaya yg anis ganjar prabowo,neutral,0.9996554851531982,neutral,0.9975385665893555
46,Sat Oct 28 23:50:05 +0000 2023,1718414866577502337,"@ParmiFajri .  kalo benar2 peduli dgn NKRI, Banyak Cawapres anak muda YANG LEBIH BAIK DARI Gibran.  Prabowo mendekati UDZUR/ sepuh.  Apa mau NKRI, kemudian presidennya Gibran ???  awas musibah !!!  .",0,0,0,0,in,2779743853,1718115376914194905,123Laptop,https://twitter.com/123Laptop/status/1718414866577502337,parmifajri kalo benar2 peduli dgn nkri cawapres anak muda gibran prabowo udzur sepuh nkri presiden gibran awas musibah,negative,0.9997246861457825,negative,0.5118415355682373
47,Sat Oct 28 23:49:24 +0000 2023,1718414696687231117,"@kafiradikalis Dulu emang milih Prabowo, sekarang udah pindah ke Amin",0,0,0,0,in,1700715401628520448,1718196123893195179,icalyopi,https://twitter.com/icalyopi/status/1718414696687231117,kafiradikalis emang milih prabowo udah pindah amin,negative,0.9634242057800293,negative,0.6757925748825073
48,Sat Oct 28 23:49:17 +0000 2023,1718414663606788154,"Wkwkwk  Jd mirip Prabowo yg selalu bawa nm Jkw  Klo ga salah prnh kritik jg kan?  Selamat ya""",0,0,0,0,in,2292624098,1718414663606788154,RAbdinyo,https://twitter.com/RAbdinyo/status/1718414663606788154,wkwkwk jd prabowo yg bawa nm jkw klo ga salah prnh kritik jg selamat,neutral,0.9996304512023926,neutral,0.6133176684379578
49,Sat Oct 28 23:49:11 +0000 2023,1718414638424232272,"@Quvvatt @klipfahri Intinya, karena programnya gagal. Mereka mencoba cuci tangan.  Seandainya berhasil, udah siang malam itu dibahas sama mereka sebagai megaprestasinya Prabowo.",0,1,1,2,in,1297750327186268161,1718408992215674917,bayuaji_bayuaji,https://twitter.com/bayuaji_bayuaji/status/1718414638424232272,quvvatt klipfahri inti program gagal coba cuci tangan hasil udah siang malam bahas megaprestasinya prabowo,neutral,0.9996657371520996,neutral,0.8185927867889404
50,Sat Oct 28 23:49:07 +0000 2023,1718414621957374388,Cerita Prabowo soal Kekaguman ke Jokowi: Ilmu Orang Solo Ini Luar Biasa https://t.co/VatJ6ucnra #TempoNasional,19,94,6,56,in,18129942,1718414621957374388,tempodotco,https://twitter.com/tempodotco/status/1718414621957374388,cerita prabowo kagum jokowi ilmu orang solo temponasional,positive,0.9994889497756958,positive,0.520999550819397
